"title","year","journal"
"O que esperar das relações Brasil-China?","2011","Revista de Sociologia e Política"
"A economia continental chinesa e seu efeito gravitacional","2011","Revista de Sociologia e Política"
"Determinantes políticos do déficit fiscal nos estados brasileiros (1987-1997)","2010","Revista de Sociologia e Política"
"A agenda da reforma dos benefícios tributários das famílias e das empresas com saúde: entre o particular e o geral","2010","Revista de Sociologia e Política"
"A questão da continuidade da política macroeconômica entre o governo Cardoso e Lula (1995-2006)","2010","Revista de Sociologia e Política"
"A questão da continuidade da política macroeconômica entre o governo Cardoso e Lula (1995-2006)","2010","Revista de Sociologia e Política"
"O campo de estudos sobre associações de classe de São Paulo de 1910 a 1945","2010","Revista de Sociologia e Política"
"Novas lideranças sul-americanas: clivagens sobre o binômio estabilidade-instabilidade política","2009","Revista de Sociologia e Política"
"Integração e desenvolvimento no Mercosul: divergências e convergências nas políticas econômicas nos governos Lula e Kirchner","2009","Revista de Sociologia e Política"
"A Petrobrás e as reformas do setor de petróleo e gás no Brasil e na Argentina","2009","Revista de Sociologia e Política"
"Uma nova noção de empresário: a naturalização do ""empreendedor""","2008","Revista de Sociologia e Política"
"O mondovino de cabeça para baixo: as transformações no mercado internacional do vinho e o novo empresariado vinícola","2008","Revista de Sociologia e Política"
"A geopolítica do sistema de estados e o capitalismo global em questão","2007","Revista de Sociologia e Política"
"A política internacional do Partido dos Trabalhadores: da fundação à diplomacia do governo Lula","2003","Revista de Sociologia e Política"
"A questão do desenvolvimento à luz da globalização da economia capitalista","2002","Revista de Sociologia e Política"
"Democracia, transição e consolidação: precisões sobre conceitos bestializados","2001","Revista de Sociologia e Política"
"Redes de clientela, funcionários régios e apropriação de renda no império português (séculos XVI-XVIII)","2001","Revista de Sociologia e Política"
"Repensando a nacionalidade de empresas transnacionais","2000","Revista de Sociologia e Política"
"A política educacional e a formação da força de trabalho industrial na era de Vargas","2000","Revista de Sociologia e Política"
"A política educacional e a formação da força de trabalho industrial na era de Vargas","2000","Revista de Sociologia e Política"
"Planejamento econômico e crise política: do esgotamento do plano de desenvolvimento ao malogro dos programas de estabilização","2000","Revista de Sociologia e Política"
"Desenvolvimento industrial e mercado de trabalho no Rio Grande do Sul: 1920-1950","2000","Revista de Sociologia e Política"
"Processos de organização de catadores de materiais recicláveis: lutas e conformações","2013","Revista Katálysis"
"Relação estado-sociedade civil nas políticas de desenvolvimento socioprodutivas na Argentina contemporânea","2011","Revista Katálysis"
"Saúde do trabalhador: considerações a partir da crítica da economia política","2011","Revista Katálysis"
"Solidariedade assimétrica: capital social, hierarquia e êxito em um empreendimento de ""economia solidária""","2009","Revista Katálysis"
"Do século 19 ao século 21: permanência e transformações da solidariedade em economia","2008","Revista Katálysis"
"Do século 19 ao século 21: permanência e transformações da solidariedade em economia","2008","Revista Katálysis"
"Do século 19 ao século 21: permanência e transformações da solidariedade em economia","2008","Revista Katálysis"
"Do século 19 ao século 21: permanência e transformações da solidariedade em economia","2008","Revista Katálysis"
"Diferentes matizes da idéia de solidariedade","2008","Revista Katálysis"
"Reestruturação capitalista e trabalho: notas críticas acerca da economia solidária","2008","Revista Katálysis"
"Economia social: conceitos, fundamentos e tipologia","2008","Revista Katálysis"
"Cooperação econômica versus competitividade social","2008","Revista Katálysis"
"Cooperação econômica versus competitividade social","2008","Revista Katálysis"
"Terceiro setor e univocidade conceitual: necessidade e elementos configuradores","2008","Revista Katálysis"
"Terceiro setor e univocidade conceitual: necessidade e elementos configuradores","2008","Revista Katálysis"
"Autogestão: desafios políticos e metodológicos na incubação de empreendimentos econômicos solidários","2008","Revista Katálysis"
"Contribuição à crítica da 'economia solidária'","2008","Revista Katálysis"
"Ação coletiva no âmbito da economia solidária e da autogestão","2008","Revista Katálysis"
"Experiências em economia solidária e seus múltiplos sentidos","2008","Revista Katálysis"
"Política social focalizada e ajuste fiscal: as duas faces do governo Lula","2007","Revista Katálysis"
"O Brasil e a dimensão econômico-social do governo Lula: resultados e perspectivas","2007","Revista Katálysis"
"As demandas de pesquisas sobre proteção social no Mercosul: exigências para o Serviço Social","2006","Revista Katálysis"
"Reflexões sobre o papel das unidades de economia da saúde no âmbito de sistemas nacionais de saúde","2016","Saúde e Sociedade"
"Reflexões sobre o papel das unidades de economia da saúde no âmbito de sistemas nacionais de saúde","2016","Saúde e Sociedade"
"Sob o prisma da equidade: financiamento federal do Sistema Único de Saúde no estado da Bahia","2016","Saúde e Sociedade"
"Sob o prisma da equidade: financiamento federal do Sistema Único de Saúde no estado da Bahia","2016","Saúde e Sociedade"
"Gestão de saúde familiar e pobreza em período de recessão económica em Portugal","2015","Saúde e Sociedade"
"Gestão de saúde familiar e pobreza em período de recessão económica em Portugal","2015","Saúde e Sociedade"
"Política de saúde na China: a influência ocidental europeia em suas reformas a partir de 1978","2015","Saúde e Sociedade"
"Política de saúde na China: a influência ocidental europeia em suas reformas a partir de 1978","2015","Saúde e Sociedade"
"A Saúde Global centrada nas pessoas","2014","Saúde e Sociedade"
"Perspectivas temporais e regionais da insegurança alimentar durante a crise econômica em Portugal, 2011-2013","2014","Saúde e Sociedade"
"Associa&#231;&#227;o espacial entre vari&#225;veis socioecon&#244;micas e risco relativo de nascimentos pr&#233;-termo na Regi&#227;o Metropolitana de S&#227;o Paulo (RMSP) e na &#193;rea Metropolitana de Lisboa (AML)","2014","Saúde e Sociedade"
"Dos conceitos de regulação às suas possibilidades","2014","Saúde e Sociedade"
"Desigualdades socioeconômicas na incidência e mortalidade por câncer: revisão de estudos ecológicos, 1998-2008","2013","Saúde e Sociedade"
"Como incluir características dos distritos do município de São Paulo em estudos epidemiológicos?: análise da desigualdade de renda pelo uso do propensity score matching","2013","Saúde e Sociedade"
"Como incluir características dos distritos do município de São Paulo em estudos epidemiológicos?: análise da desigualdade de renda pelo uso do propensity score matching","2013","Saúde e Sociedade"
"Avaliação econômica da rubéola e de estratégia de controle em situação de surto em Fortaleza (Ceará), Brasil","2011","Saúde e Sociedade"
"Comportamentos de saúde e doença numa comunidade Cabo-Verdiana em Lisboa","2011","Saúde e Sociedade"
"Empréstimos externos para o setor saúde no Brasil: soluções ou problemas","2009","Saúde e Sociedade"
"Condições socioeconômicas, programas de complementação alimentar e mortalidade infantil no Estado de São Paulo (1950 a 2000)","2003","Saúde e Sociedade"
"Grau de cobertura dos planos de saúde e distribuição regional do gasto público em saúde","2001","Saúde e Sociedade"
"Grau de cobertura dos planos de saúde e distribuição regional do gasto público em saúde","2001","Saúde e Sociedade"
"Desenvolvimento, saúde e meio ambiente: contradições na construção de hidrelétricas","2015","Serviço Social & Sociedade"
"O novo desenvolvimentismo e a decadência ideológica do pensamento econômico brasileiro","2012","Serviço Social & Sociedade"
"Desenvolvimentismo e neodesenvolvimentismo: tragédia e farsa","2012","Serviço Social & Sociedade"
"Propriedades coletivas, cooperativismo e economia solidária no Brasil","2011","Serviço Social & Sociedade"
"Copagamentos no Sistema Público Brasileiro: anomalia ou tendência?","2011","Serviço Social & Sociedade"
"MODELO DE EQUAÇÕES DE DIFERENÇAS FINITAS APLICADO AO SISTEMA DE SAÚDE SUPLEMENTAR","2015","Trabalho, Educação e Saúde"
"Desenvolvimento local - ou sobre exegeses ideológicas, lutas hegemônicas e descaminhos societários","2013","Trabalho, Educação e Saúde"
"Economia popular e educação: percursos de uma cooperativa de reciclagem de lixo no Rio de Janeiro","2009","Trabalho, Educação e Saúde"
"Construtores de casa e artífices de cidadania: modos cooperativos de trabalhar e viver","2008","Trabalho, Educação e Saúde"
