"title","year","journal"
"Dinâmica de mercado e trajetória de produtores em face do sistema de classificação de vinhos","2007","Revista de Administração de Empresas"
"Dinâmica de mercado e trajetória de produtores em face do sistema de classificação de vinhos","2007","Revista de Administração de Empresas"
"Economia e empreendedorismo étnico: balanço histórico da experiência paulista","2007","Revista de Administração de Empresas"
"Economia e empreendedorismo étnico: balanço histórico da experiência paulista","2007","Revista de Administração de Empresas"
"Contribuição da nova sociologia econômica para repensar a economia no sentido do desenvolvimento sustentável","2007","Revista de Administração de Empresas"
"Contribuição da nova sociologia econômica para repensar a economia no sentido do desenvolvimento sustentável","2007","Revista de Administração de Empresas"
"Empresas brasileiras e o desafio da competitividade","2007","Revista de Administração de Empresas"
"Teoria das organizações e a nova sociologia econômica: um diálogo interdisciplinar","2006","Revista de Administração de Empresas"
"Teoria das organizações e a nova sociologia econômica: um diálogo interdisciplinar","2006","Revista de Administração de Empresas"
"O ambiente das díades de canalde marketing: um arcabouço para análises comparativas","2006","Revista de Administração de Empresas"
"Previsão da volatilidade no mercado interbancário de câmbio","2005","Revista de Administração de Empresas"
"A internacionalização das empresas portuguesas: a experiência brasileira","2005","Revista de Administração de Empresas"
"A internacionalização das empresas portuguesas: a experiência brasileira","2005","Revista de Administração de Empresas"
"Unificando a alocação de capital em bancos e seguradoras no Brasil","2004","Revista de Administração de Empresas"
"Relacionamentos colaborativos em redes de suprimentos","2004","Revista de Administração de Empresas"
"Efeitos fiscais da inflação na análise de projetos","2001","Revista de Administração de Empresas"
"Medindo o capital intelectual","2001","Revista de Administração de Empresas"
"Alocação de recursos financeiros em projetos de risco na exploração de petróleo","2000","Revista de Administração de Empresas"
"Emerging Latin America","1999","Revista de Administração de Empresas"
"Emerging Latin America","1999","Revista de Administração de Empresas"
"A legislação complementar sobre finanças públicas e orçamentos: subsídios e sugestões para a sua elaboração","1999","Revista de Administração de Empresas"
"Proposta de metodologia para análise dos grupos econômicos","1996","Revista de Administração de Empresas"
"Políticas de governo e planejamento estratégico como problemas de escolha pública - I","1996","Revista de Administração de Empresas"
"Políticas de governo e planejamento estratégico como problemas de escolha pública - I","1996","Revista de Administração de Empresas"
"Políticas de governo e planejamento estratégico como problemas de escolha pública: II","1996","Revista de Administração de Empresas"
"Políticas de governo e planejamento estratégico como problemas de escolha pública: II","1996","Revista de Administração de Empresas"
"Reestruturação industrial, terceirização e redes de subcontratação","1995","Revista de Administração de Empresas"
"A dinâmica do mercado high-tech","1995","Revista de Administração de Empresas"
"Estratégias empresariais e instrumentos econômicos de gestão ambiental","1995","Revista de Administração de Empresas"
"Estratégias empresariais e instrumentos econômicos de gestão ambiental","1995","Revista de Administração de Empresas"
"Desagregação do sistema soviético e transformação das formas de propriedade","1993","Revista de Administração de Empresas"
"Economias do pacífico asiático: ""tigres e dragões""","1993","Revista de Administração de Empresas"
"Economias do pacífico asiático: ""tigres e dragões""","1993","Revista de Administração de Empresas"
"O desafio da eqüidade no setor saúde","1993","Revista de Administração de Empresas"
"Instrumentos econômicos para gerenciamento ambiental: a cobrança pelo uso da água no estado de São Paulo","1993","Revista de Administração de Empresas"
"Gestão econômico-administrativa japonesa","1993","Revista de Administração de Empresas"
"Gestão econômico-administrativa japonesa","1993","Revista de Administração de Empresas"
"Especialização flexível: uma alternativa promissora para o desenvolvimento econômico de regiões subdesenvolvidas","1993","Revista de Administração de Empresas"
"Especialização flexível: uma alternativa promissora para o desenvolvimento econômico de regiões subdesenvolvidas","1993","Revista de Administração de Empresas"
"Japão milagre econômico e sacrifício social","1992","Revista de Administração de Empresas"
"Devemos salvar os anos 90!","1992","Revista de Administração de Empresas"
"Inflaçao e lote econômico de compra","1992","Revista de Administração de Empresas"
"Os senadores-empresários: recrutamento, carreira e partidos políticos dos empresários no Senado brasileiro (1986-2010)","2014","Revista Brasileira de Ciência Política"
"Democracia e economia solidária: limitações e potencialidades","2013","Revista Brasileira de Ciência Política"
"Recorrência e evolução no capitalismo mundial: os ciclos de acumulação de Giovanni Arrighi","2011","Revista Brasileira de Ciência Política"
"As ideias do poder e o poder das ideias: o Banco Mundial como ator político-intelectual","2014","Revista Brasileira de Educação"
"Educação e pobreza: limiares de um campo em (re)definição","2012","Revista Brasileira de Educação"
"Dimensões estratégicas e limites do papel da educação para o desenvolvimento brasileiro","2011","Revista Brasileira de Educação"
"Economia e educação: a contribuição de Álvaro Vieira Pinto para o estudo histórico da tecnologia","2006","Revista Brasileira de Educação"
"O empresariado industrial e a educação brasileira","2003","Revista Brasileira de Educação"
"Rentabilidade da Produção de Acerola Orgânica Sob Condição Determinística e de Risco: estudo do distrito de irrigação Tabuleiro Litorâneo do Piauí","2016","Revista de Economia e Sociologia Rural"
"Economias de Escala e Eficiência Econômica na Produção de Laranja no Estado de São Paulo ,","2016","Revista de Economia e Sociologia Rural"
"Características das Famílias, Estruturação da Produção e Estratégias de Comercialização em um Assentamento de Reforma Agrária","2016","Revista de Economia e Sociologia Rural"
"Modelling Beef and Dairy Sectors' Productivities and their Effects on Land Use Change in Brazil","2016","Revista de Economia e Sociologia Rural"
"Coordenação do Comércio Atacadista de Pescado no Mercado do Ver-o-Peso, em Belém-Pará","2016","Revista de Economia e Sociologia Rural"
"Impactos Econômicos do Código Florestal Brasileiro: uma discussão à luz de um modelo computável de equilíbrio geral","2015","Revista de Economia e Sociologia Rural"
"Atratividade de Canaviais Paulistas Sob a Ótica da Teoria das Opções Reais","2015","Revista de Economia e Sociologia Rural"
"Análises Quase-experimentais Sobre o Impacto das Cooperativas de Crédito Rural Solidário no PIB Municipal da Agropecuária","2015","Revista de Economia e Sociologia Rural"
"Estudo Sobre a Decomposição dos Determinantes da Variação da Pobreza nos Estados Brasileiros no Período 2001 a 2012","2015","Revista de Economia e Sociologia Rural"
"O Comportamento do Preço da Terra Agrícola: um modelo de painel de dados espaciais","2015","Revista de Economia e Sociologia Rural"
"Uma perspectiva evolucionária da economia agrícola: o caso da produção ovina no Brasil e Uruguai","2014","Revista de Economia e Sociologia Rural"
"Uma perspectiva evolucionária da economia agrícola: o caso da produção ovina no Brasil e Uruguai","2014","Revista de Economia e Sociologia Rural"
"Agricultura familiar, seu interesse acadêmico, sua lógica constitutiva e sua resiliência no Brasil","2014","Revista de Economia e Sociologia Rural"
"Mensuração das elasticidades-preço da demanda, cruzada e renda no mercado de etanol brasileiro: um estudo usando painéis cointegrados","2013","Revista de Economia e Sociologia Rural"
"Causas do desmatamento no Brasil e seu ordenamento no contexto mundial","2012","Revista de Economia e Sociologia Rural"
"A influência de fatores econômicos, institucionais e sociais na inserção de agroindústrias rurais em Santa Catarina","2012","Revista de Economia e Sociologia Rural"
"Produção agropecuária em municípios de Minas Gerais (1996-2006): padrões de distribuição, especialização e associação espacial","2012","Revista de Economia e Sociologia Rural"
"Produção agropecuária em municípios de Minas Gerais (1996-2006): padrões de distribuição, especialização e associação espacial","2012","Revista de Economia e Sociologia Rural"
"Os determinantes socioeconômicos do estado de saúde das crianças do Brasil rural","2012","Revista de Economia e Sociologia Rural"
"Retorno econômico dos investimentos em P&D na citricultura paulista","2012","Revista de Economia e Sociologia Rural"
"Direitos de propriedade da terra rural no Brasil: uma proposta institucionalista para ampliar a governança fundiária","2012","Revista de Economia e Sociologia Rural"
"Análise do impacto econômico do crédito rural na microrregião de Pirapora","2012","Revista de Economia e Sociologia Rural"
"Estrutura produtiva agropecuária e desempenho econômico regional: o caso do Rio Grande do Sul, 1996-2008","2012","Revista de Economia e Sociologia Rural"
"Impactos econômicos da introdução do milho Bt11 no Brasil: uma abordagem de equilíbrio geral inter-regional","2011","Revista de Economia e Sociologia Rural"
"Determinantes do uso de medidas sanitárias de controle da brucelose e tuberculose bovinas","2011","Revista de Economia e Sociologia Rural"
"Desempenho dos arranjos institucionais e minimização dos custos de transação: transações entre produtores e fecularias de mandioca","2011","Revista de Economia e Sociologia Rural"
"Desempenho dos arranjos institucionais e minimização dos custos de transação: transações entre produtores e fecularias de mandioca","2011","Revista de Economia e Sociologia Rural"
"Desmatamento e crescimento econômico no Brasil: uma análise da curva de Kuznets ambiental para a Amazônia legal","2011","Revista de Economia e Sociologia Rural"
"Análise de um projeto agroindustrial utilizando a Teoria de Opções Reais: a opção de adiamento","2011","Revista de Economia e Sociologia Rural"
"Impacto econômico da reserva legal sobre diferentes tipos de unidades de produção agropecuária","2011","Revista de Economia e Sociologia Rural"
"Entrepreneurship in the Rio Grande do Sul, Brazil: the determinants and consequences for the municipal development","2010","Revista de Economia e Sociologia Rural"
"Benefícios sociais da política de incentivos à cultura de mamão no Estado do Ceará","2010","Revista de Economia e Sociologia Rural"
"Gripe aviária no Brasil: uma análise econômica de equilíbrio geral","2010","Revista de Economia e Sociologia Rural"
"Valoração econômica dos efeitos internos da erosão: impactos da produção de soja no cerrado piauiense","2010","Revista de Economia e Sociologia Rural"
"O efeito do título de propriedade da terra na determinação da renda rural","2010","Revista de Economia e Sociologia Rural"
"Um estudo das deliberações da Câmara Setorial do Açúcar e do Álcool, usando análise de correspondência","2009","Revista de Economia e Sociologia Rural"
"A ""masculinização"" da produção de leite","2009","Revista de Economia e Sociologia Rural"
"Agroindústria canavieira e crescimento econômico local","2009","Revista de Economia e Sociologia Rural"
"Agroindústria canavieira e crescimento econômico local","2009","Revista de Economia e Sociologia Rural"
"Agroindústria canavieira e crescimento econômico local","2009","Revista de Economia e Sociologia Rural"
"Consumo de fertilizantes e produtividade da laranja em São Paulo ao longo das décadas de 1970, 1980 e 1990","2009","Revista de Economia e Sociologia Rural"
"Lealdade e oportunismo nas cooperativas: desafios e mudanças na gestão","2009","Revista de Economia e Sociologia Rural"
"Agricultura, população e dinâmica macroeconômica de municípios rurais: um estudo em Lagoa dos Três Cantos (RS)","2009","Revista de Economia e Sociologia Rural"
"Agricultura, população e dinâmica macroeconômica de municípios rurais: um estudo em Lagoa dos Três Cantos (RS)","2009","Revista de Economia e Sociologia Rural"
"Políticas públicas, distribuição de renda e pobreza no meio rural brasileiro no período de 1995 a 2005","2009","Revista de Economia e Sociologia Rural"
"Existe convergência espacial da produtividade agrícola no Brasil?","2008","Revista de Economia e Sociologia Rural"
"Análise da participação da agropecuária no PIB dos EUA de 1960 a 2001","2008","Revista de Economia e Sociologia Rural"
"Avaliação de contratos: uma abordagem utilizando a Análise Fatorial de Correspondência","2008","Revista de Economia e Sociologia Rural"
"Relações sinérgicas e efeitos sobre a produção setorial no sistema inter-regional Paraná-Restante do Brasil","2008","Revista de Economia e Sociologia Rural"
"Impactos econômicos e ambientais decorrentes do estado de conservação das rodovias brasileiras: um estudo de caso","2008","Revista de Economia e Sociologia Rural"
"Economia política da disputa por terras em Minas Gerais","2008","Revista de Economia e Sociologia Rural"
"Economia política da disputa por terras em Minas Gerais","2008","Revista de Economia e Sociologia Rural"
"Determinantes dos arranjos contratuais: o caso da transação produtor-processador de carne bovina no Uruguai","2008","Revista de Economia e Sociologia Rural"
"A balança comercial do agronegócio brasileiro de 1989 a 2005","2008","Revista de Economia e Sociologia Rural"
"A expansão da União Européia em 2004 e seus impactos no agronegócio brasileiro","2008","Revista de Economia e Sociologia Rural"
"A expansão da União Européia em 2004 e seus impactos no agronegócio brasileiro","2008","Revista de Economia e Sociologia Rural"
"PRONAF dez anos depois: resultados e perspectivas para o desenvolvimento rural","2007","Revista de Economia e Sociologia Rural"
"Custos e escala de produção na pecuária leiteira: estudo nos principais estados produtores do Brasil","2007","Revista de Economia e Sociologia Rural"
"Economias de escala na produção de leite: uma análise dos estados de Rondônia, Tocantins e Rio de Janeiro","2007","Revista de Economia e Sociologia Rural"
"Avaliação benefício-custo de sistemas de dessalinização de água em comunidades rurais cearenses","2007","Revista de Economia e Sociologia Rural"
"Análise da influência de alguns fatores socioeconômicos e demográficos no consumo domiciliar de carnes no Brasil","2006","Revista de Economia e Sociologia Rural"
"Eficiência técnica e desempenho econômico de produtores de leite no Estado do Ceará, Brasil","2006","Revista de Economia e Sociologia Rural"
"Análise econômica da produção de ovinos em lotação rotativa em pastagem de capim tanzânia (Panicum maximum (Jacq))","2006","Revista de Economia e Sociologia Rural"
"Economias de escala na produção de frangos de corte no Brasil","2005","Revista de Economia e Sociologia Rural"
"Relação econômica dos setores agrícolas do Estado do Mato Grosso com os demais setores pertencentes tanto ao Estado quanto ao restante do Brasil","2005","Revista de Economia e Sociologia Rural"
"Análise exploratória da socioeconomia de sistemas agroflorestais em várzea flúvio-marinha, Cametá-Pará, Brasil","2004","Revista de Economia e Sociologia Rural"
"Fontes de ineficiência da pequena produção familiar agrícola na região Recôncavo do Estado da Bahia","2004","Revista de Economia e Sociologia Rural"
"Estrutura produtiva, relações intersetoriais e cooperativas agropecuárias no Paraná em 1980 e 1985","2004","Revista de Economia e Sociologia Rural"
"Estrutura produtiva, relações intersetoriais e cooperativas agropecuárias no Paraná em 1980 e 1985","2004","Revista de Economia e Sociologia Rural"
"Pobreza rural e degradação ambiental: uma refutação da hipótese do círculo vicioso","2004","Revista de Economia e Sociologia Rural"
"Critério para implantação de tecnologias de suprimentos de água potável em municípios cearenses afetados pelo alto teor de sal","2004","Revista de Economia e Sociologia Rural"
"MEECA: um modelo econométrico espacial para projeção consistente de culturas agropecuárias","2004","Revista de Economia e Sociologia Rural"
"MEECA: um modelo econométrico espacial para projeção consistente de culturas agropecuárias","2004","Revista de Economia e Sociologia Rural"
"Análise de viabilidade econômica e de risco da fruticultura na região norte Fluminense","2004","Revista de Economia e Sociologia Rural"
"Análise de viabilidade econômica e de risco da fruticultura na região norte Fluminense","2004","Revista de Economia e Sociologia Rural"
"Dinâmica da agricultura e desenvolvimento no Rio Grande do Sul","2003","Revista de Economia e Sociologia Rural"
"Dinâmica da agricultura e desenvolvimento no Rio Grande do Sul","2003","Revista de Economia e Sociologia Rural"
"Análise da comercialização de energia elétrica cogerada pelo setor sucroalcooleiro no estado de São Paulo","2003","Revista de Economia e Sociologia Rural"
"Análise da comercialização de energia elétrica cogerada pelo setor sucroalcooleiro no estado de São Paulo","2003","Revista de Economia e Sociologia Rural"
"Políticas de estabilização macroeconômica do plano real e seus efeitos sobre o agronegócio brasileiro","2003","Revista de Economia e Sociologia Rural"
"Políticas de estabilização macroeconômica do plano real e seus efeitos sobre o agronegócio brasileiro","2003","Revista de Economia e Sociologia Rural"
"Avaliação socioeconômica do Programa Reforma Agrária Solidária nos municípios de Iguatu e Quixeramobim - Estado do Ceará","2002","Revista de Economia e Sociologia Rural"
"Avaliação socioeconômica do Programa Reforma Agrária Solidária nos municípios de Iguatu e Quixeramobim - Estado do Ceará","2002","Revista de Economia e Sociologia Rural"
"Natureza das funções econômicas alargadas do Estado na economia brasileira","2016","Revista de Economia Política"
"Natureza das funções econômicas alargadas do Estado na economia brasileira","2016","Revista de Economia Política"
"Evolução dos preços no mercado brasileiro de terras (1994-2010): uma análise à luz da teoria pós-keynesiana","2016","Revista de Economia Política"
"As famílias na abordagem Minskyana: aspectos e desdobramentos do endividamento das famílias americanas no século XX e início do XXI","2016","Revista de Economia Política"
"Avaliando a dinâmica dos termos de troca em um modelo de causalidade cumulativa e mudança estrutural","2016","Revista de Economia Política"
"Sobre a cadeia de cconomia criativa no Brasil: potencial e desafios","2016","Revista de Economia Política"
"Reflexões sobre o Novo Desenvolvimentismo e o Desenvolvimentismo Clássico","2016","Revista de Economia Política"
"O modelo sueco: uma alternativa para a política macroeconômica","2016","Revista de Economia Política"
"Da fisiologia à economia política: o itinerário intelectual de Quesnay em direção ao Tableau Économique","2016","Revista de Economia Política"
"A estrutura e o mercado: uma análise comparativa do Plano Trienal e do PAEG","2016","Revista de Economia Política"
"A estrutura e o mercado: uma análise comparativa do Plano Trienal e do PAEG","2016","Revista de Economia Política"
"A estrutura e o mercado: uma análise comparativa do Plano Trienal e do PAEG","2016","Revista de Economia Política"
"A estrutura e o mercado: uma análise comparativa do Plano Trienal e do PAEG","2016","Revista de Economia Política"
"A reconstrução da indústria brasileira: a conexão entre o regime macroeconômico e a política industrial","2016","Revista de Economia Política"
"A reconstrução da indústria brasileira: a conexão entre o regime macroeconômico e a política industrial","2016","Revista de Economia Política"
"Overvaluation trend of the Brazilian currency in the 2000s: empirical estimation","2015","Revista de Economia Política"
"Hirschman e a dessacraliza&#231;&#227;o da epopeia do desenvolvimento por um desenvolvimentista","2015","Revista de Economia Política"
"Institutions, credibility and crisis: the inconsistencies of Argentine exchange rate policy (1991-2006)","2015","Revista de Economia Política"
"Global instability of currencies: reasons and perspectives according to the state-corporation hegemonic stability theory","2015","Revista de Economia Política"
"Global instability of currencies: reasons and perspectives according to the state-corporation hegemonic stability theory","2015","Revista de Economia Política"
"Chronic macro-economic and financial imbalances in the world economy: a meta-economic view","2015","Revista de Economia Política"
"The structuralist tradition in economics: methodological and macroeconomics aspects","2015","Revista de Economia Política"
"Emerging markets and the international financial architecture: a blueprint for reform","2015","Revista de Economia Política"
"The boom and crisis of the Convertibility Plan in Argentina","2015","Revista de Economia Política"
"Continuidade ou ruptura? Uma an&#225;lise de alguns aspectos da filosofia social de John Stuart Mill, Alfred Marshall e John Maynard Keynes","2015","Revista de Economia Política"
"Globalization and democracy","2015","Revista de Economia Política"
"Globalization and democracy","2015","Revista de Economia Política"
"Globalization and democracy","2015","Revista de Economia Política"
"O desafio macroeconômico de 2015-2018","2015","Revista de Economia Política"
"As armadilhas do tripé da política macroeconômica brasileira","2015","Revista de Economia Política"
"Rethinking ""energy nationalism"": a study of the relationship between nation states and companies in the oil industry","2015","Revista de Economia Política"
"Why budget accountability fails? The elusive links between parliaments and audit agencies in the oversight of the budget","2015","Revista de Economia Política"
"Da Idade do Ouro a Era Platinum Rastejante: uma periodização do desenvolvimento Latino Americano na tradição Robinsoniana","2015","Revista de Economia Política"
"A economia neoclássica: uma análise lakatosiana Da cheia do mainstream até sua implosão","2015","Revista de Economia Política"
"A economia neoclássica: uma análise lakatosiana Da cheia do mainstream até sua implosão","2015","Revista de Economia Política"
"Renda fundiária brasileira apropriada por proprietários de terras","2015","Revista de Economia Política"
"As razões do laissez-faire: uma análise do ataque ao mercantilismo e da defesa da liberdade econômica na Riqueza das Nações","2007","Revista de Economia Política"
"Ciclos políticos, socioeconomia e a geografia eleitoral do estado da Bahia nas eleições de 2006","2015","Revista de Sociologia e Política"
"Efetividade das políticas participativas no governo brasileiro: o Conselho de Desenvolvimento Econômico e Social","2015","Revista de Sociologia e Política"
"A crise da potência inteligente: os EUA e a grande estratégia de acomodação no governo Obama","2014","Revista de Sociologia e Política"
"Índia em transformação: o novo crescimento econômico e as perspectivas pós-crises","2014","Revista de Sociologia e Política"
"Voto econômico retrospectivo e sofisticação política na eleição presidencial de 2002","2014","Revista de Sociologia e Política"
"Alemanha: o modelo de capitalismo social e os desafios no limiar do século XXI","2014","Revista de Sociologia e Política"
"Em nome de quem? Governo, instituições e economia política no campo do combate às doenças respiratórias: o caso da lei antitabaco em Portugal","2014","Revista de Sociologia e Política"
"Elite empresarial e elite econômica: o estudo dos empresários","2014","Revista de Sociologia e Política"
"Institucionalização e execução das políticas públicas de economia solidária no Brasil","2013","Revista de Sociologia e Política"
"Empresários, o governo do PT e o desenvolvimentismo","2013","Revista de Sociologia e Política"
"Elite econômica no Brasil: discussões acerca da internacionalização da carreira de executivos brasileiros","2013","Revista de Sociologia e Política"
"Como se explica o neoliberalismo no Brasil? uma análise crítica dos artigos publicados na Revista Dados","2013","Revista de Sociologia e Política"
"Os ""doutores"" da federação: formação acadêmica dos senadores brasileiros e variáveis associadas","2012","Revista de Sociologia e Política"
"Mercado, transação e laços sociais: a abordagem da Sociologia Econômica","2012","Revista de Sociologia e Política"
"Mercado, transação e laços sociais: a abordagem da Sociologia Econômica","2012","Revista de Sociologia e Política"
"A economia política do modelo econômico chinês: o estado, o mercado e os principais desafios","2012","Revista de Sociologia e Política"
"Capital social e democracia: a confiança realmente importa?","2011","Revista de Sociologia e Política"
